{
  "schema_version": 1,
  "id": "transfer-1",
  "model_id": "deepseek-ai/deepseek-ocr-gguf",
  "operation": "download",
  "mode": "execute",
  "execution_location": "local_mobile",
  "target_id": "phone-this-device",
  "state": "verifying",
  "have_bytes": 2147483648,
  "total_bytes": 2147483648,
  "verification": "pending",
  "fault_code": null,
  "updated_at": "2026-08-04T12:00:00Z"
}
